id,type,text,question_images,answer_images,options,answers,explanation
179,mcq,A company has created a custom model by fine-tuning an existing large language model (LLM) from Amazon Bedrock. The company wants to deploy the model to production and use the model to handle a steady rate of requests each minute. Which solution meets these requirements MOST cost-effectively?,,,A.Deploy the model by using an Amazon EC2 compute optimized instance.|B.Use the model with on-demand throughput on Amazon Bedrock.|C.Store the model in Amazon S3 and host the model by using AWS Lambda.|D.Purchase Provisioned Throughput for the model on Amazon Bedrock.,D,
180,mcq,Which technique involves training AI models on labeled datasets to adapt the models to specific industry terminology and requirements?,,,A.Data augmentation|B.Fine-tuning|C.Model quantization|D.Continuous pre-training,B,
181,mcq,"A company is creating an agent for its application by using Amazon Bedrock Agents. The agent is performing well, but the company wants to improve the agentâ€™s accuracy by providing some specific examples. Which solution meets these requirements?",,,A.Modify the advanced prompts for the agent to include the examples.|B.Create a guardrail for the agent that includes the examples.|C.Use Amazon SageMaker Ground Truth to label the examples.|D.Run a script in AWS Lambda that adds the examples to the training dataset.,A,
182,mcq,Which option is a benefit of using infrastructure as code (IaC) in machine learning operations (MLOps)?,,,"A.IaC eliminates the need for hyperparameter tuning.|B.IaC always provisions powerful compute instances, contributing to the training of more accurate models.|C.IaC streamlines the deployment of scalable and consistent ML workloads in cloud environments.|D.IaC minimizes overall expenses by deploying only low-cost instances.",C,
183,mcq,A company wants to fine-tune a foundation model (FM) to answer questions for a specific domain. The company wants to use instruction-based fine-tuning. How should the company prepare the training data?,,,A.Gather company internal documents and industry-specific materials. Merge the documents and materials into a single file.|B.Collect external company reviews from various online sources. Manually label each review as either positive or negative.|C.Create pairs of questions and answers that specifically address topics related to the company's industry domain.|D.Create few-shot prompts to instruct the model to answer only domain knowledge.,C,
184,mcq,Which ML technique ensures data compliance and privacy when training AI models on AWS?,,,A.Reinforcement learning|B.Transfer learning|C.Federated learning|D.Unsupervised learning,C,
185,hotspot,HOTSPOT - A company needs to customize a base model that is hosted on Amazon Bedrock. Select the correct model customization method from the following list of company requirements. Each model customization method should be selected one or more times.,images/aifc01_topic1_q184_image13.png,images/aifc01_topic1_q184_image14.png,Fine-tuning|Continued pre-training,Fine-tuning|Continued pre-training|Continued pre-training,
186,mcq,A manufacturing company has an application that ingests consumer complaints from publicly available sources. The application uses complex hard-coded logic to process the complaints. The company wants to scale this logic across markets and product lines. Which advantage do generative AI models offer for this scenario?,,,A.Predictability of outputs|B.Adaptability|C.Less sensitivity to changes in inputs|D.Explainability,B,
187,mcq,A financial company wants to flag all credit card activity as possibly fraudulent or non-fraudulent based on transaction data. Which type of ML model meets these requirements?,,,A.Regression|B.Diffusion|C.Binary classification|D.Multi-class classification,C,
188,hotspot,HOTSPOT - A company is designing a customer service chatbot by using a fine-tuned large language model (LLM). The company wants to ensure that the chatbot uses responsible AI characteristics. Select the correct responsible AI characteristic from the following list for each application design action. Each responsible AI characteristic should be selected one time or not at all.,images/aifc01_topic1_q187_image15.png,images/aifc01_topic1_q187_image16.png,Governance|Privacy and Security|Safety|Transparency,Privacy and Security|Transparency|Safety,
189,mcq,A hospital wants to use a generative AI solution with speech-to-text functionality to help improve employee skills in dictating clinical notes. Which AWS service meets these requirements?,,,A.Amazon Q Developer|B.Amazon Polly|C.Amazon Rekognition|D.AWS HealthScribe,D,